{
  "id": 3,
  "slug": "parallel-parking",
  "name_en": "Parallel Parking",
  "name_pt": "Estacionamento em Paralelo",
  "sort_order": 3,
  "overview": {
    "en": "Parallel parking on the Japanese driving test requires you to back into a narrow bay marked by white lines, typically within a 90-second time limit. The space is only about 1.5 times the length of a standard vehicle, leaving minimal margin for error. This maneuver tests your spatial awareness, steering precision, and ability to judge distances while reversing. The most critical aspect is performing continuous visual checks in all directions while the vehicle is moving backward. Examiners deduct points for failing to check behind, touching the boundary lines, or taking too long. You are allowed three corrections, meaning three shifts between drive and reverse to reposition. Exceeding this limit results in instant failure. The standard technique involves aligning your side mirror with the target bay marker, turning the wheel fully to one side, reversing at an angle, then straightening and turning the wheel the opposite way to swing the front end into position. Many candidates fail because they rush the initial alignment or forget to check their blind spots during the maneuver. The time pressure is intentional, simulating real-world parking situations where hesitation blocks traffic.",
    "pt": "O estacionamento em paralelo no teste de direcao japones exige que voce de re em uma vaga estreita marcada por linhas brancas, tipicamente dentro de um limite de 90 segundos. O espaco tem apenas cerca de 1,5 vezes o comprimento de um veiculo padrao, deixando margem minima para erro. Esta manobra testa sua consciencia espacial, precisao de direcao e capacidade de julgar distancias enquanto da re. O aspecto mais critico e realizar verificacoes visuais continuas em todas as direcoes enquanto o veiculo se move para tras. Os examinadores deduzem pontos por nao verificar atras, tocar nas linhas limite ou demorar demais. Sao permitidas tres correcoes, ou seja, tres mudancas entre drive e re para se reposicionar. Exceder esse limite resulta em reprovacao imediata. A tecnica padrao envolve alinhar o retrovisor lateral com o marcador da vaga alvo, girar o volante totalmente para um lado, dar re em angulo, entao endireitar e girar o volante para o lado oposto para balancar a frente na posicao. Muitos candidatos falham porque apressam o alinhamento inicial ou esquecem de verificar os pontos cegos durante a manobra. A pressao do tempo e intencional, simulando situacoes reais de estacionamento onde a hesitacao bloqueia o trafego."
  },
  "svg_path": "assets/skill/parallel-parking-diagram.svg",
  "correct_trajectory": {
    "keypoints": [
      { "x": 50, "y": 200, "label": "Align mirror" },
      { "x": 100, "y": 200, "label": "Full lock right" },
      { "x": 150, "y": 250, "label": "Reverse at 45 deg" },
      { "x": 200, "y": 300, "label": "Straighten wheel" },
      { "x": 250, "y": 300, "label": "Continue reverse" },
      { "x": 300, "y": 300, "label": "Full lock left" },
      { "x": 350, "y": 280, "label": "Centered in bay" }
    ],
    "path": [
      { "x": 50, "y": 200 },
      { "x": 80, "y": 200 },
      { "x": 110, "y": 210 },
      { "x": 140, "y": 230 },
      { "x": 165, "y": 255 },
      { "x": 185, "y": 275 },
      { "x": 200, "y": 290 },
      { "x": 220, "y": 298 },
      { "x": 245, "y": 300 },
      { "x": 270, "y": 298 },
      { "x": 295, "y": 292 },
      { "x": 315, "y": 285 },
      { "x": 335, "y": 280 },
      { "x": 350, "y": 280 }
    ]
  },
  "wrong_trajectory": {
    "keypoints": [
      { "x": 50, "y": 200, "label": "Overshoot bay" },
      { "x": 120, "y": 200, "label": "Turn too late" },
      { "x": 160, "y": 240, "label": "Rear hits back line" },
      { "x": 200, "y": 280, "label": "Front sticks out" },
      { "x": 250, "y": 300, "label": "Correction 1" },
      { "x": 300, "y": 290, "label": "Correction 2" },
      { "x": 350, "y": 280, "label": "Correction 3 - fail" }
    ],
    "path": [
      { "x": 50, "y": 200 },
      { "x": 90, "y": 200 },
      { "x": 130, "y": 205 },
      { "x": 160, "y": 220 },
      { "x": 180, "y": 245 },
      { "x": 195, "y": 270 },
      { "x": 210, "y": 285 },
      { "x": 230, "y": 295 },
      { "x": 255, "y": 298 },
      { "x": 280, "y": 295 },
      { "x": 305, "y": 288 },
      { "x": 325, "y": 282 },
      { "x": 350, "y": 280 }
    ],
    "failure_reason": {
      "en": "The driver passes the target bay before beginning to reverse, then turns the wheel too late. The rear of the vehicle strikes the back boundary line. Multiple corrections are needed to pull the front end in, exhausting the three-correction limit and failing the test.",
      "pt": "O motorista passa da vaga alvo antes de comecar a dar re, entao gira o volante tarde demais. A traseira do veiculo atinge a linha limite traseira. Sao necessarias multiplas correcoes para puxar a frente para dentro, esgotando o limite de tres correcoes e reprovando no teste."
    }
  },
  "common_mistakes": {
    "en": [
      "Passing the target bay marker before stopping to begin the reverse maneuver",
      "Failing to perform visual checks in all directions while reversing",
      "Turning the steering wheel too late, causing the rear to hit the back boundary line",
      "Rushing the maneuver and exceeding the 90-second time limit",
      "Not using all three reference points (side mirror, rear window, side windows) to judge position"
    ],
    "pt": [
      "Passar do marcador da vaga alvo antes de parar para iniciar a manobra de re",
      "Nao realizar verificacoes visuais em todas as direcoes enquanto da re",
      "Girar o volante tarde demais, fazendo a traseira atingir a linha limite traseira",
      "Apressar a manobra e exceder o limite de tempo de 90 segundos",
      "Nao usar todos os tres pontos de referencia (retrovisor lateral, janela traseira, janelas laterais) para julgar a posicao"
    ]
  },
  "checklist": [
    {
      "step": 1,
      "text": {
        "en": "Drive past the target bay and stop when your side mirror aligns with the bay marker",
        "pt": "Passe pela vaga alvo e pare quando seu retrovisor lateral se alinhar com o marcador da vaga"
      },
      "pass_criteria": {
        "en": "Vehicle is parallel to the bay, side mirror aligned with reference point",
        "pt": "Veiculo esta paralelo a vaga, retrovisor lateral alinhado com ponto de referencia"
      }
    },
    {
      "step": 2,
      "text": {
        "en": "Check all mirrors and blind spots, signal reverse, and begin backing up with wheel fully turned",
        "pt": "Verifique todos os retrovisores e pontos cegos, sinalize re e comece a dar re com volante totalmente girado"
      },
      "pass_criteria": {
        "en": "Head turns visible, mirrors checked, reverse signal activated",
        "pt": "Giro de cabeca visivel, retrovisores verificados, sinal de re ativado"
      }
    },
    {
      "step": 3,
      "text": {
        "en": "Reverse at a 45-degree angle until the vehicle is halfway into the bay",
        "pt": "De re em angulo de 45 graus ate o veiculo estar na metade da vaga"
      },
      "pass_criteria": {
        "en": "Vehicle angle is approximately 45 degrees, rear wheels clear the back line",
        "pt": "Angulo do veiculo e aproximadamente 45 graus, rodas traseiras liberam a linha traseira"
      }
    },
    {
      "step": 4,
      "text": {
        "en": "Straighten the wheel and continue reversing until the front end is clear of the adjacent vehicle",
        "pt": "Endireite o volante e continue dando re ate a frente estar livre do veiculo adjacente"
      },
      "pass_criteria": {
        "en": "Vehicle is parallel to the bay lines, front bumper within bay boundaries",
        "pt": "Veiculo esta paralelo as linhas da vaga, para-choque dianteiro dentro dos limites da vaga"
      }
    },
    {
      "step": 5,
      "text": {
        "en": "Turn the wheel opposite direction to swing the front end into the bay, then center the vehicle",
        "pt": "Gire o volante na direcao oposta para balancar a frente na vaga, entao centralize o veiculo"
      },
      "pass_criteria": {
        "en": "Vehicle is centered within bay lines, equal distance from both sides, within time limit",
        "pt": "Veiculo esta centralizado dentro das linhas da vaga, distancia igual de ambos os lados, dentro do limite de tempo"
      }
    }
  ],
  "pro_tip": {
    "en": "Keep your eyes moving between all three mirrors and the rear window while reversing, because stationary checks do not count.",
    "pt": "Mantenha os olhos se movendo entre os tres retrovisores e a janela traseira enquanto da re, porque verificacoes estaticas nao contam."
  }
}
